{
  "schema": "source-inventory/v1",
  "inventory_id": "INV-MAT-09-POLYNOMIALS-M1P33-50-M2P1-11",
  "subject": "Mathematics",
  "members": [
    {
      "acquisition_ref": "ACQ-0B3450C353FF29985152",
      "sha256": "0b3450c353ff299851528edd4469bc01413920135b0fd041fe89286a00086afa",
      "pages": "33-50"
    },
    {
      "acquisition_ref": "ACQ-1DD05CE5AA04B532EC68",
      "sha256": "1dd05ce5aa04b532ec68c4054f55af1677ecb210be00b8f3085d6f29215a230c",
      "pages": "1-11"
    }
  ],
  "declared_scope": "PAGE_RANGE",
  "completeness_unit": "every numbered source item in m1 PDF pages 33-50 and m2 PDF pages 1-11",
  "items": [
    {
      "item_id": "M1-P35-ILLUSTRATION-2-1-2-1",
      "locator": {
        "acquisition_ref": "ACQ-0B3450C353FF29985152",
        "page": 35,
        "label": "Illustration 2.1"
      },
      "format": "OTHER",
      "source_role": "WORKED_EXAMPLE",
      "question_card": "EV-MAT-09-POL-M1-B01-ILL-02-01-W",
      "key": {
        "state": "ABSENT"
      }
    },
    {
      "item_id": "M1-P35-ILLUSTRATION-2-2-2-2",
      "locator": {
        "acquisition_ref": "ACQ-0B3450C353FF29985152",
        "page": 35,
        "label": "Illustration 2.2"
      },
      "format": "OTHER",
      "source_role": "WORKED_EXAMPLE",
      "question_card": "EV-MAT-09-POL-M1-B01-ILL-02-02-W",
      "key": {
        "state": "ABSENT"
      }
    },
    {
      "item_id": "M1-P36-ILLUSTRATION-2-3-2-3",
      "locator": {
        "acquisition_ref": "ACQ-0B3450C353FF29985152",
        "page": 36,
        "label": "Illustration 2.3"
      },
      "format": "OTHER",
      "source_role": "WORKED_EXAMPLE",
      "question_card": "EV-MAT-09-POL-M1-B01-ILL-02-03-W",
      "key": {
        "state": "ABSENT"
      }
    },
    {
      "item_id": "M1-P36-ILLUSTRATION-2-4-2-4",
      "locator": {
        "acquisition_ref": "ACQ-0B3450C353FF29985152",
        "page": 36,
        "label": "Illustration 2.4"
      },
      "format": "OTHER",
      "source_role": "WORKED_EXAMPLE",
      "question_card": "EV-MAT-09-POL-M1-B01-ILL-02-04-W",
      "key": {
        "state": "ABSENT"
      }
    },
    {
      "item_id": "M1-P36-ILLUSTRATION-2-5-2-5",
      "locator": {
        "acquisition_ref": "ACQ-0B3450C353FF29985152",
        "page": 36,
        "label": "Illustration 2.5"
      },
      "format": "OTHER",
      "source_role": "WORKED_EXAMPLE",
      "question_card": "EV-MAT-09-POL-M1-B01-ILL-02-05-W",
      "key": {
        "state": "ABSENT"
      }
    },
    {
      "item_id": "M1-P36-ILLUSTRATION-2-6-2-6",
      "locator": {
        "acquisition_ref": "ACQ-0B3450C353FF29985152",
        "page": 36,
        "label": "Illustration 2.6"
      },
      "format": "OTHER",
      "source_role": "WORKED_EXAMPLE",
      "question_card": "EV-MAT-09-POL-M1-B01-ILL-02-06-W",
      "key": {
        "state": "ABSENT"
      }
    },
    {
      "item_id": "M1-P37-ILLUSTRATION-2-7-2-7",
      "locator": {
        "acquisition_ref": "ACQ-0B3450C353FF29985152",
        "page": 37,
        "label": "Illustration 2.7"
      },
      "format": "OTHER",
      "source_role": "WORKED_EXAMPLE",
      "question_card": "EV-MAT-09-POL-M1-B01-ILL-02-07-W",
      "key": {
        "state": "ABSENT"
      }
    },
    {
      "item_id": "M1-P37-ILLUSTRATION-2-8-2-8",
      "locator": {
        "acquisition_ref": "ACQ-0B3450C353FF29985152",
        "page": 37,
        "label": "Illustration 2.8"
      },
      "format": "OTHER",
      "source_role": "WORKED_EXAMPLE",
      "question_card": "EV-MAT-09-POL-M1-B01-ILL-02-08-W",
      "key": {
        "state": "ABSENT"
      }
    },
    {
      "item_id": "M1-P37-ILLUSTRATION-2-9-2-9",
      "locator": {
        "acquisition_ref": "ACQ-0B3450C353FF29985152",
        "page": 37,
        "label": "Illustration 2.9"
      },
      "format": "OTHER",
      "source_role": "WORKED_EXAMPLE",
      "question_card": "EV-MAT-09-POL-M1-B01-ILL-02-09-W",
      "key": {
        "state": "ABSENT"
      }
    },
    {
      "item_id": "M1-P37-ILLUSTRATION-2-10-2-10",
      "locator": {
        "acquisition_ref": "ACQ-0B3450C353FF29985152",
        "page": 37,
        "label": "Illustration 2.10"
      },
      "format": "OTHER",
      "source_role": "WORKED_EXAMPLE",
      "question_card": "EV-MAT-09-POL-M1-B01-ILL-02-10-W",
      "key": {
        "state": "ABSENT"
      }
    },
    {
      "item_id": "M1-P38-EXAMPLE-2-11-2-11",
      "locator": {
        "acquisition_ref": "ACQ-0B3450C353FF29985152",
        "page": 38,
        "label": "Example 2.11"
      },
      "format": "OTHER",
      "source_role": "WORKED_EXAMPLE",
      "question_card": "EV-MAT-09-POL-M1-B01-EX-02-11-W",
      "key": {
        "state": "ABSENT"
      }
    },
    {
      "item_id": "M1-P38-ILLUSTRATION-2-12-2-12",
      "locator": {
        "acquisition_ref": "ACQ-0B3450C353FF29985152",
        "page": 38,
        "label": "Illustration 2.12"
      },
      "format": "OTHER",
      "source_role": "WORKED_EXAMPLE",
      "question_card": "EV-MAT-09-POL-M1-B01-ILL-02-12-W",
      "key": {
        "state": "ABSENT"
      }
    },
    {
      "item_id": "M1-P39-CHECK-POINT-1-1",
      "locator": {
        "acquisition_ref": "ACQ-0B3450C353FF29985152",
        "page": 39,
        "label": "Check Point 1"
      },
      "format": "SHORT",
      "source_role": "QUESTION",
      "question_card": "EV-MAT-09-POL-M1-B01-CP1-01-Q",
      "key": {
        "state": "PRESENT",
        "card": "EV-MAT-09-POL-M1-CP1-01-K"
      }
    },
    {
      "item_id": "M1-P39-CHECK-POINT-1-2",
      "locator": {
        "acquisition_ref": "ACQ-0B3450C353FF29985152",
        "page": 39,
        "label": "Check Point 1 2"
      },
      "format": "SHORT",
      "source_role": "QUESTION",
      "question_card": "EV-MAT-09-POL-M1-B01-CP1-02-Q",
      "key": {
        "state": "PRESENT",
        "card": "EV-MAT-09-POL-M1-CP1-02-K"
      }
    },
    {
      "item_id": "M1-P39-CHECK-POINT-1-3",
      "locator": {
        "acquisition_ref": "ACQ-0B3450C353FF29985152",
        "page": 39,
        "label": "Check Point 1 3"
      },
      "format": "SHORT",
      "source_role": "QUESTION",
      "question_card": "EV-MAT-09-POL-M1-B01-CP1-03-Q",
      "key": {
        "state": "PRESENT",
        "card": "EV-MAT-09-POL-M1-CP1-03-K"
      }
    },
    {
      "item_id": "M1-P39-CHECK-POINT-1-4",
      "locator": {
        "acquisition_ref": "ACQ-0B3450C353FF29985152",
        "page": 39,
        "label": "Check Point 1 4"
      },
      "format": "SHORT",
      "source_role": "QUESTION",
      "question_card": "EV-MAT-09-POL-M1-B01-CP1-04-Q",
      "key": {
        "state": "PRESENT",
        "card": "EV-MAT-09-POL-M1-CP1-04-K"
      }
    },
    {
      "item_id": "M1-P39-CHECK-POINT-1-5",
      "locator": {
        "acquisition_ref": "ACQ-0B3450C353FF29985152",
        "page": 39,
        "label": "Check Point 1 5"
      },
      "format": "SHORT",
      "source_role": "QUESTION",
      "question_card": "EV-MAT-09-POL-M1-B01-CP1-05-Q",
      "key": {
        "state": "PRESENT",
        "card": "EV-MAT-09-POL-M1-CP1-05-K"
      }
    },
    {
      "item_id": "M1-P40-ILLUSTRATION-2-13-2-13",
      "locator": {
        "acquisition_ref": "ACQ-0B3450C353FF29985152",
        "page": 40,
        "label": "Illustration 2.13"
      },
      "format": "OTHER",
      "source_role": "WORKED_EXAMPLE",
      "question_card": "EV-MAT-09-POL-M1-B01-ILL-02-13-W",
      "key": {
        "state": "ABSENT"
      }
    },
    {
      "item_id": "M1-P40-ILLUSTRATION-2-14-2-14",
      "locator": {
        "acquisition_ref": "ACQ-0B3450C353FF29985152",
        "page": 40,
        "label": "Illustration 2.14"
      },
      "format": "OTHER",
      "source_role": "WORKED_EXAMPLE",
      "question_card": "EV-MAT-09-POL-M1-B01-ILL-02-14-W",
      "key": {
        "state": "ABSENT"
      }
    },
    {
      "item_id": "M1-P41-ILLUSTRATION-2-15-2-15",
      "locator": {
        "acquisition_ref": "ACQ-0B3450C353FF29985152",
        "page": 41,
        "label": "Illustration 2.15"
      },
      "format": "OTHER",
      "source_role": "WORKED_EXAMPLE",
      "question_card": "EV-MAT-09-POL-M1-B01-ILL-02-15-W",
      "key": {
        "state": "ABSENT"
      }
    },
    {
      "item_id": "M1-P41-ILLUSTRATION-2-16-2-16",
      "locator": {
        "acquisition_ref": "ACQ-0B3450C353FF29985152",
        "page": 41,
        "label": "Illustration 2.16"
      },
      "format": "OTHER",
      "source_role": "WORKED_EXAMPLE",
      "question_card": "EV-MAT-09-POL-M1-B01-ILL-02-16-W",
      "key": {
        "state": "ABSENT"
      }
    },
    {
      "item_id": "M1-P41-ILLUSTRATION-2-17-2-17",
      "locator": {
        "acquisition_ref": "ACQ-0B3450C353FF29985152",
        "page": 41,
        "label": "Illustration 2.17"
      },
      "format": "OTHER",
      "source_role": "WORKED_EXAMPLE",
      "question_card": "EV-MAT-09-POL-M1-B01-ILL-02-17-W",
      "key": {
        "state": "ABSENT"
      }
    },
    {
      "item_id": "M1-P42-EXAMPLE-2-18-2-18",
      "locator": {
        "acquisition_ref": "ACQ-0B3450C353FF29985152",
        "page": 42,
        "label": "Example 2.18"
      },
      "format": "OTHER",
      "source_role": "WORKED_EXAMPLE",
      "question_card": "EV-MAT-09-POL-M1-B01-EX-02-18-W",
      "key": {
        "state": "ABSENT"
      }
    },
    {
      "item_id": "M1-P42-ILLUSTRATION-2-19-2-19",
      "locator": {
        "acquisition_ref": "ACQ-0B3450C353FF29985152",
        "page": 42,
        "label": "Illustration 2.19"
      },
      "format": "OTHER",
      "source_role": "WORKED_EXAMPLE",
      "question_card": "EV-MAT-09-POL-M1-B01-ILL-02-19-W",
      "key": {
        "state": "ABSENT"
      }
    },
    {
      "item_id": "M1-P42-ILLUSTRATION-2-20-2-20",
      "locator": {
        "acquisition_ref": "ACQ-0B3450C353FF29985152",
        "page": 42,
        "label": "Illustration 2.20"
      },
      "format": "OTHER",
      "source_role": "WORKED_EXAMPLE",